{
  "$id": "https://jxsuite.com/schema/extension-manifest/v1",
  "$schema": "https://json-schema.org/draft/2020-12/schema",
  "title": "Jx Extension Manifest",
  "additionalProperties": false,
  "description": "Schema for jx-extension.json manifests. Located at the extension package root and exported so hosts can resolve <package>/jx-extension.json through the exports map.",
  "properties": {
    "$schema": {
      "type": "string"
    },
    "classes": {
      "additionalProperties": {
        "type": "string"
      },
      "description": "$prototype-visible class name → class descriptor path, relative to the manifest.",
      "type": "object"
    },
    "description": {
      "description": "One-line description.",
      "type": "string"
    },
    "name": {
      "description": "Package name; must match package.json.",
      "type": "string"
    },
    "schemas": {
      "additionalProperties": false,
      "description": "Schema fragments this package contributes, relative to the manifest.",
      "properties": {
        "document": {
          "description": "Document-schema fragment (positions like $paths values).",
          "type": "string"
        },
        "fields": {
          "description": "Field-union fragment: its $defs members are unioned into the per-project field-schema resource as extension field extras (specs/extensions.md §5.3).",
          "type": "string"
        },
        "project": {
          "description": "Project-schema fragment (top-level project.json sections).",
          "type": "string"
        }
      },
      "type": "object"
    },
    "title": {
      "description": "Human-readable name for studio surfaces.",
      "type": "string"
    }
  },
  "required": [
    "name"
  ],
  "type": "object"
}